{
  "kind": "repolens.pr_schau.delta",
  "version": 1,
  "repo": "test_repo",
  "generated_at": "2026-02-26T19:37:48.249395+00:00",
  "summary": {
    "added": 1,
    "changed": 0,
    "removed": 0
  },
  "files": [
    {
      "path": "new_file.txt",
      "status": "added",
      "category": "docs",
      "size_bytes": 3,
      "sha256": "11507a0e2f5e69d5dfa40a62a1bd7b6ee57e6bcd85c67c9b8431b36fff21c437",
      "sha256_status": "ok"
    }
  ]
}